{
  "data_tags": ["pii"],
  "rules": {
    "snowflake.query": {"required_tags": ["pii"], "decision": "require_approval"},
    "copilot.summarize": {"required_tags": ["pii"], "decision": "allow"},
    "salesforce.update": {"required_tags": [], "decision": "allow"}
  },
  "masking": {"pii": "redact"},
  "approval_roles": ["Approver"]
}
